{
  "sample_rate": 48000,
  "channels": 2,
  "tuning": {
    "temperament": "equal",
    "a4_hz": 440.0
  },
  "tail_seconds": 2.0,
  "events": [
    {
      "time": 0.0,
      "type": "articulation",
      "name": "damped"
    },
    {
      "time": 0.0,
      "type": "note_on",
      "note_id": 1,
      "midi_note": 53,
      "velocity": 0.35
    },
    {
      "time": 0.7,
      "type": "note_off",
      "note_id": 1
    },
    {
      "time": 1.1,
      "type": "articulation",
      "name": "open"
    },
    {
      "time": 1.1,
      "type": "note_on",
      "note_id": 2,
      "midi_note": 69,
      "velocity": 0.82
    },
    {
      "time": 2.0,
      "type": "note_off",
      "note_id": 2
    },
    {
      "time": 2.6,
      "type": "articulation",
      "name": "hard_damped"
    },
    {
      "time": 2.6,
      "type": "note_on",
      "note_id": 3,
      "midi_note": 77,
      "velocity": 0.45
    },
    {
      "time": 3.3,
      "type": "note_off",
      "note_id": 3
    },
    {
      "time": 3.8,
      "type": "articulation",
      "name": "hard_open"
    },
    {
      "time": 3.8,
      "type": "note_on",
      "note_id": 4,
      "midi_note": 89,
      "velocity": 0.92
    },
    {
      "time": 4.7,
      "type": "note_off",
      "note_id": 4
    },
    {
      "time": 5.4,
      "type": "articulation",
      "name": "bowed"
    },
    {
      "time": 5.4,
      "type": "note_on",
      "note_id": 5,
      "midi_note": 74,
      "velocity": 0.72
    },
    {
      "time": 8.4,
      "type": "note_off",
      "note_id": 5
    }
  ]
}
