{
  "sample_rate": 48000,
  "channels": 2,
  "tuning": { "temperament": "equal", "a4_hz": 440.0 },
  "tail_seconds": 0.9,
  "events": [
    { "time": 0.0, "type": "articulation", "name": "sustain" },
    { "time": 0.0, "type": "control", "name": "expression", "value": 0.78 },
    { "time": 0.0, "type": "control", "name": "breath", "value": 0.72 },
    { "time": 0.0, "type": "control", "name": "noise", "value": 0.22 },
    { "time": 0.0, "type": "note_on", "note_id": 1, "midi_note": 56, "velocity": 0.35 },
    { "time": 0.75, "type": "note_off", "note_id": 1 },
    { "time": 1.0, "type": "note_on", "note_id": 2, "midi_note": 72, "velocity": 0.62 },
    { "time": 1.55, "type": "note_off", "note_id": 2 },
    { "time": 1.78, "type": "note_on", "note_id": 3, "midi_note": 72, "velocity": 0.62 },
    { "time": 2.33, "type": "note_off", "note_id": 3 },
    { "time": 2.56, "type": "note_on", "note_id": 4, "midi_note": 72, "velocity": 0.62 },
    { "time": 3.11, "type": "note_off", "note_id": 4 },
    { "time": 3.34, "type": "control", "name": "expression", "value": 0.94 },
    { "time": 3.34, "type": "control", "name": "breath", "value": 0.9 },
    { "time": 3.34, "type": "note_on", "note_id": 5, "midi_note": 88, "velocity": 0.94 },
    { "time": 3.7, "type": "control", "name": "modulation", "value": 0.85 },
    { "time": 4.35, "type": "note_off", "note_id": 5 },
    { "time": 4.6, "type": "articulation", "name": "legato" },
    { "time": 4.6, "type": "control", "name": "modulation", "value": 0.25 },
    { "time": 4.6, "type": "note_on", "note_id": 6, "midi_note": 74, "velocity": 0.62 },
    { "time": 5.25, "type": "note_on", "note_id": 7, "midi_note": 76, "velocity": 0.66 },
    { "time": 5.35, "type": "note_off", "note_id": 6 },
    { "time": 6.05, "type": "note_off", "note_id": 7 },
    { "time": 6.3, "type": "articulation", "name": "sustain" },
    { "time": 6.3, "type": "control", "name": "sustain_pedal", "value": 1.0 },
    { "time": 6.3, "type": "note_on", "note_id": 8, "midi_note": 67, "velocity": 0.5 },
    { "time": 6.95, "type": "note_off", "note_id": 8 },
    { "time": 7.35, "type": "control", "name": "sustain_pedal", "value": 0.0 }
  ]
}
