{
  "sample_rate": 48000,
  "tuning": { "temperament": "equal", "a4_hz": 440.0 },
  "tail_seconds": 4.0,
  "events": [
    { "time": 0.0, "type": "control", "name": "expression", "value": 0.75 },
    { "time": 0.0, "type": "note_on", "note_id": 1, "midi_note": 48, "velocity": 0.70 },
    { "time": 0.0, "type": "note_on", "note_id": 2, "midi_note": 55, "velocity": 0.66 },
    { "time": 0.0, "type": "note_on", "note_id": 3, "midi_note": 60, "velocity": 0.62 },
    { "time": 2.0, "type": "control", "name": "modulation", "value": 0.76 },
    { "time": 4.0, "type": "note_off", "note_id": 1 },
    { "time": 4.0, "type": "note_off", "note_id": 2 },
    { "time": 4.0, "type": "note_off", "note_id": 3 }
  ]
}
